{
  "schema_version": "qlog.v1",
  "experiment_id": "NIC-CLEANROOM-001",
  "entries": [
    {
      "id": "Q1",
      "section": "§3",
      "type": "UNDERSPECIFIED",
      "claim": {
        "summary": "§3 specifies integer formatting as 'base-10 ASCII digits, no leading zeros, no decimal point' but never addresses negative integers — whether they appear in-domain or how the minus sign interacts with the no-leading-zeros rule.",
        "interpretation": "Implemented standard signed-decimal formatting (i64::to_string() in Rust): negative values emit a leading minus sign followed by digits with no leading zeros; 0 emits as the single digit '0'. No negative integer ever appears in any op this spec defines, so this choice is never exercised by any corpus case."
      },
      "evidence": {
        "source": "SPEC",
        "note": "Implementer scanned all hashed values across every op in §11.1 and confirmed no negative integer appears; the formatter still required a defined behavior for the i64 type."
      },
      "resolution": {
        "status": "ACCEPTED",
        "spec_patch_applied": false,
        "corpus_exercises_this": false,
        "note": "Latent gap: the spec's guarantee that negatives 'never appear' does not constitute a formatting rule for the case where they do. A future registry or proof document containing a negative integer would expose this underspecification."
      },
      "classification_rationale": "The spec defines integer formatting for the positive/zero case via 'no leading zeros, no decimal point' but treats non-integer numbers as 'not defined' rather than addressing negatives explicitly. Negatives are integers, not non-integers, so they are not covered by the 'not defined' clause — and not covered by the formatting rule either. This is a genuine gap: the implementer introduced sign-handling logic that has no explicit spec anchor."
    },
    {
      "id": "Q2",
      "section": "§3",
      "type": "WELL_SPECIFIED_CONFIRMED",
      "subtype": "EXPLICIT_SPECIFIED",
      "cause": ["direct_spec_text"],
      "claim": {
        "summary": "§3 specifies object key sorting by 'ordinary string comparison (UTF-16 code-unit order)'. Is the parenthetical literally UTF-16 code-unit order (which diverges from UTF-8 byte/codepoint order for supplementary-plane codepoints), or a casual synonym for 'the usual way'?",
        "interpretation": "Implemented literal UTF-16 code-unit-order comparison (Vec<u16> lexicographic, via str::encode_utf16). This diverges from UTF-8 byte order only for codepoints above U+FFFF; the explicit parenthetical is read as a deliberate disambiguation, not a redundant gloss."
      },
      "evidence": {
        "source": "SPEC",
        "note": "The spec introduces the parenthetical specifically after 'ordinary string comparison' — signaling the author considered the ambiguity and chose to name a specific ordering rather than leave it to convention."
      },
      "resolution": {
        "status": "CONFIRMED",
        "spec_patch_applied": false,
        "corpus_exercises_this": false,
        "note": "No corpus case uses object keys containing supplementary-plane codepoints (U+10000+), so this distinction is not corpus-testable with the current golden corpus — a corpus gap."
      },
      "classification_rationale": "The spec explicitly and parenthetically names 'UTF-16 code-unit order' after 'ordinary string comparison' — the parenthetical exists specifically to disambiguate from the casual reading. This is the highest-signal phrasing in all of §3: the author wrote a parenthetical precisely because 'ordinary comparison' is ambiguous between UTF-8-byte order and UTF-16 code-unit order, and chose to resolve it. No inference required beyond literal reading of the named ordering."
    },
    {
      "id": "Q3",
      "section": "§6 step 1",
      "type": "WELL_SPECIFIED_CONFIRMED",
      "subtype": "STRUCTURALLY_DETERMINED",
      "cause": ["type_system_guarantee", "language_conditioned"],
      "claim": {
        "summary": "§6 step 1 says 'if the input is already text, reject if it contains an unpaired UTF-16 surrogate.' Rust's String/str cannot represent unpaired surrogates at the type level — what does this rule mean in a language where violations are structurally unreachable?",
        "interpretation": "RawPath::Text(&str) performs no explicit surrogate check — Rust's type system provides the guarantee vacuously (no &str can contain a surrogate). The bytes variant (RawPath::Bytes) genuinely exercises the 'decode strictly as UTF-8' half of step 1."
      },
      "evidence": {
        "source": "SPEC",
        "note": "The spec's rule is fully correct and precisely stated. The language's type system provides a stronger guarantee than the rule requires, making the check trivially satisfiable without explicit code."
      },
      "resolution": {
        "status": "VACUOUSLY_SATISFIED",
        "spec_patch_applied": false,
        "corpus_exercises_this": false,
        "note": "IMPORTANT — language-specific caveat: this entry is classified WELL_SPECIFIED_CONFIRMED for a Rust implementation specifically. In a JavaScript or Java implementation, the same rule is an active, non-vacuous check requiring explicit code. A future cross-language comparison of Q-logs should flag this: the classification depends on language type-system semantics, not purely on spec text. This is not a spec defect — the spec was written with JS/Java in mind and is correct — but it means this entry's classification is language-conditioned."
      },
      "classification_rationale": "The spec rule is unambiguous: reject text containing unpaired UTF-16 surrogates. Rust's type invariant for &str makes this check vacuously true for all representable inputs — the precondition for a violation is unreachable in well-typed Rust code. The specification fully determines the behavior (reject on surrogate); the Rust implementation provides a free proof that no such rejection is ever needed. Classified WELL_SPECIFIED_CONFIRMED because no inference about the rule's *intent* was needed — only about how to satisfy an already-clear rule in a type-safe language."
    },
    {
      "id": "Q4",
      "section": "§6 step 4",
      "type": "WELL_SPECIFIED_CONFIRMED",
      "subtype": "EXPLICIT_SPECIFIED",
      "cause": ["frozen_step_order", "direct_spec_text"],
      "claim": {
        "summary": "§6 step 4 lists two rejection conditions as sequential sentences: 'if starts with /, reject (absolute path). If the first segment contains :, reject (drive-qualified path).' For an input satisfying both (e.g. /C:/x), which rejection fires?",
        "interpretation": "Implemented in exactly the written order: absolute-path check first (short-circuits), drive-qualified check second. An input like /C:/x is always rejected as 'absolute path'; the drive check is never reached."
      },
      "evidence": {
        "source": "SPEC"
      },
      "resolution": {
        "status": "CONFIRMED",
        "spec_patch_applied": false,
        "corpus_exercises_this": false,
        "note": "No corpus case is simultaneously absolute and drive-qualified. The step-order freeze ('The step order below is frozen — every step is mandatory, none may be skipped') applies within a step as well as across steps."
      },
      "classification_rationale": "The broader §6 framing explicitly freezes step order and prohibits recovery or reordering. Within step 4, the two conditions are written as consecutive, independent conditional sentences with no 'or', 'either', or 'whichever applies' language. Sequential conditional sentences in a frozen-order specification unambiguously prescribe sequential evaluation. The question dissolved on re-reading; no inference was needed."
    },
    {
      "id": "Q5",
      "section": "§5",
      "type": "WELL_SPECIFIED_CONFIRMED",
      "subtype": "EXPLICIT_SPECIFIED",
      "cause": ["direct_spec_text", "explicit_exclusion"],
      "claim": {
        "summary": "§5's fail-closed disallowed-syntax rejection ([]{} !) is stated for 'a pattern containing...' — does this restriction also apply to the path argument of glob_match?",
        "interpretation": "Only the pattern argument is checked against the disallowed set. The path argument is matched as literal data with no character-set restriction; [, ], {, }, ! are legal filesystem characters and never function as glob operators in path."
      },
      "evidence": {
        "source": "SPEC"
      },
      "resolution": {
        "status": "CONFIRMED",
        "spec_patch_applied": false,
        "corpus_exercises_this": true,
        "note": "Corpus includes expect_error cases for patterns containing disallowed characters; none test the path argument's character set."
      },
      "classification_rationale": "The spec text says precisely 'a pattern containing any of []{} !', not 'a pattern or path.' The entire §5 grammar section defines what operators are recognized in the pattern argument — path is never parsed for operators and therefore has no operator-syntax restriction to enforce. The disallowed-syntax rule's stated purpose is fail-closed safety against unrecognized operator syntax; that purpose is not relevant to literal-data path arguments. No inference required."
    },
    {
      "id": "Q6",
      "section": "§5",
      "type": "WELL_SPECIFIED_CONFIRMED",
      "subtype": "STRUCTURALLY_DETERMINED",
      "cause": ["grammar_impossibility"],
      "claim": {
        "summary": "§5 defines a pattern segment that is exactly '**' as unconditionally the directory-crossing wildcard, with no escape syntax defined anywhere. A path segment literally named '**' therefore cannot be matched by a non-wildcard literal pattern — is this intentional?",